{
  "plan_version": "1.0",
  "image_id": "000000012576",
  "prompt": "a cheerful, upbeat scene",
  "regions": [
    {
      "object": "wood_floor",
      "grounding_phrase": "the table where the pizza and glasses are placed",
      "base_prior": "kb:wood_floor",
      "modifiers": [
        {
          "family": "weather",
          "value": "overcast",
          "effect": "diffuse illumination flattens chroma, slight cool cast"
        },
        {
          "family": "mood",
          "value": "cheerful",
          "effect": "saturated, warm-leaning"
        }
      ],
      "resolved_colour": {
        "space": "Lab",
        "L": 68.6,
        "a": 12.0,
        "b": 29.0
      },
      "tolerance_delta_e": 9.0,
      "confidence": 0.8,
      "rationale": "[mood_cheerful] KB prior 'wood_floor' mode 'pale'; modifiers: mood:cheerful; not operative: weather:overcast; birch/pine blond",
      "id": "wood_floor"
    },
    {
      "object": "wall_interior",
      "grounding_phrase": "the wall behind the woman",
      "base_prior": "kb:wall_interior",
      "modifiers": [
        {
          "family": "weather",
          "value": "overcast",
          "effect": "diffuse illumination flattens chroma, slight cool cast"
        },
        {
          "family": "mood",
          "value": "cheerful",
          "effect": "saturated, warm-leaning"
        }
      ],
      "resolved_colour": {
        "space": "Lab",
        "L": 9.0,
        "a": 1.7,
        "b": 5.2
      },
      "tolerance_delta_e": 6.0,
      "confidence": 0.8,
      "rationale": "[mood_cheerful] KB prior 'wall_interior' mode 'white'; modifiers: weather:overcast, mood:cheerful; off-white paint",
      "id": "wall_interior"
    }
  ]
}