{
  "plan_version": "1.0",
  "image_id": "000000010092",
  "prompt": "a photograph taken in the 1970s",
  "regions": [
    {
      "object": "bedding",
      "grounding_phrase": "the bed with a mosquito net canopy",
      "base_prior": null,
      "modifiers": [
        {
          "family": "weather",
          "value": "overcast",
          "effect": "diffuse illumination flattens chroma, slight cool cast"
        },
        {
          "family": "era",
          "value": "1970s",
          "effect": "avocado / harvest gold / burnt orange across decor, dress, and cars"
        }
      ],
      "resolved_colour": {
        "space": "Lab",
        "L": 43.9,
        "a": -0.0,
        "b": 0.0
      },
      "tolerance_delta_e": 10.5,
      "confidence": 0.8,
      "rationale": "[era_1970s] KB prior 'bedding' mode 'avocado'; modifiers: era:1970s; not operative: weather:overcast; avocado green | ABLATION: colour #808080 chosen by model, KB bypassed",
      "id": "bedding"
    },
    {
      "object": "curtain",
      "grounding_phrase": "the curtains on the left side of the room",
      "base_prior": null,
      "modifiers": [
        {
          "family": "weather",
          "value": "overcast",
          "effect": "diffuse illumination flattens chroma, slight cool cast"
        },
        {
          "family": "era",
          "value": "1970s",
          "effect": "avocado / harvest gold / burnt orange across decor, dress, and cars"
        }
      ],
      "resolved_colour": {
        "space": "Lab",
        "L": 43.5,
        "a": -0.0,
        "b": 0.0
      },
      "tolerance_delta_e": 9.0,
      "confidence": 0.8,
      "rationale": "[era_1970s] KB prior 'curtain' mode 'neutral'; modifiers: era:1970s; not operative: weather:overcast; cream/white window dressing | ABLATION: colour #808080 chosen by model, KB bypassed",
      "id": "curtain"
    },
    {
      "object": "window",
      "grounding_phrase": "the large window on the left side of the room",
      "base_prior": null,
      "modifiers": [
        {
          "family": "weather",
          "value": "overcast",
          "effect": "diffuse illumination flattens chroma, slight cool cast"
        },
        {
          "family": "era",
          "value": "1970s",
          "effect": "avocado / harvest gold / burnt orange across decor, dress, and cars"
        }
      ],
      "resolved_colour": {
        "space": "Lab",
        "L": 97.3,
        "a": -0.0,
        "b": 0.0
      },
      "tolerance_delta_e": 7.5,
      "confidence": 0.8,
      "rationale": "[era_1970s] KB prior 'window' mode 'glazing'; modifiers: weather:overcast, era:1970s; glass reflects sky - cool cast | ABLATION: colour #FFFFFF chosen by model, KB bypassed",
      "id": "window"
    },
    {
      "object": "rug",
      "grounding_phrase": "the rug beneath the bed",
      "base_prior": null,
      "modifiers": [
        {
          "family": "weather",
          "value": "overcast",
          "effect": "diffuse illumination flattens chroma, slight cool cast"
        },
        {
          "family": "era",
          "value": "1970s",
          "effect": "avocado / harvest gold / burnt orange across decor, dress, and cars"
        }
      ],
      "resolved_colour": {
        "space": "Lab",
        "L": 51.8,
        "a": -0.0,
        "b": 0.0
      },
      "tolerance_delta_e": 15.0,
      "confidence": 0.8,
      "rationale": "[era_1970s] KB prior 'rug' mode 'warm'; modifiers: era:1970s; not operative: weather:overcast; warm reds/browns common in rugs | ABLATION: colour #808080 chosen by model, KB bypassed",
      "id": "rug"
    },
    {
      "object": "wood_floor",
      "grounding_phrase": "the small table next to the bed",
      "base_prior": null,
      "modifiers": [
        {
          "family": "weather",
          "value": "overcast",
          "effect": "diffuse illumination flattens chroma, slight cool cast"
        },
        {
          "family": "era",
          "value": "1970s",
          "effect": "avocado / harvest gold / burnt orange across decor, dress, and cars"
        }
      ],
      "resolved_colour": {
        "space": "Lab",
        "L": 51.8,
        "a": -0.0,
        "b": 0.0
      },
      "tolerance_delta_e": 10.5,
      "confidence": 0.8,
      "rationale": "[era_1970s] KB prior 'wood_floor' mode 'varnished'; modifiers: era:1970s; not operative: weather:overcast; warm mid-brown finish | ABLATION: colour #808080 chosen by model, KB bypassed",
      "id": "wood_floor"
    }
  ],
  "global": {
    "modifiers": [
      {
        "family": "geography",
        "value": "tropics",
        "effect": "saturated greens; turquoise shallow water"
      }
    ],
    "rationale": "A tranquil bedroom interior with a mosquito net canopy bed, surrounded by large windows and tropical foliage visible outside. [dropped ungrounded globals: mood:nostalgic]"
  }
}