{
  "plan_version": "1.0",
  "image_id": "000000018770",
  "prompt": "a melancholic, sombre scene",
  "regions": [
    {
      "object": "suit",
      "grounding_phrase": "the dark suit of the man",
      "base_prior": null,
      "modifiers": [
        {
          "family": "mood",
          "value": "melancholic",
          "effect": "desaturate + cool bias (the project's canonical mood)"
        }
      ],
      "resolved_colour": {
        "space": "Lab",
        "L": 5.5,
        "a": -0.0,
        "b": 0.0
      },
      "tolerance_delta_e": 6.0,
      "confidence": 0.8,
      "rationale": "[mood_melancholic] KB prior 'suit' mode 'charcoal'; modifiers: mood:melancholic; black/charcoal | ABLATION: colour #1a1a1a chosen by model, KB bypassed",
      "id": "suit"
    },
    {
      "object": "wall_interior",
      "grounding_phrase": "the dark wall behind the man",
      "base_prior": null,
      "modifiers": [
        {
          "family": "mood",
          "value": "melancholic",
          "effect": "desaturate + cool bias (the project's canonical mood)"
        }
      ],
      "resolved_colour": {
        "space": "Lab",
        "L": 8.2,
        "a": -0.0,
        "b": 0.0
      },
      "tolerance_delta_e": 6.0,
      "confidence": 0.8,
      "rationale": "[mood_melancholic] KB prior 'wall_interior' mode 'white'; modifiers: mood:melancholic; off-white paint | ABLATION: colour #333333 chosen by model, KB bypassed",
      "id": "wall_interior"
    }
  ]
}