{
  "plan_version": "1.0",
  "image_id": "000000001761",
  "prompt": "a photograph taken in the 1910s",
  "regions": [
    {
      "object": "building_facade",
      "grounding_phrase": "the Sydney Harbour Bridge",
      "base_prior": "kb:building_facade",
      "modifiers": [
        {
          "family": "weather",
          "value": "overcast",
          "effect": "diffuse illumination flattens chroma, slight cool cast"
        },
        {
          "family": "era",
          "value": "1910s",
          "effect": "muted palette; sober dyes, and cars essentially all black"
        }
      ],
      "resolved_colour": {
        "space": "Lab",
        "L": 33.7,
        "a": 15.5,
        "b": 14.5
      },
      "tolerance_delta_e": 10.5,
      "confidence": 0.8,
      "rationale": "[era_1910s] KB prior 'building_facade' mode 'brick_red'; modifiers: weather:overcast; not operative: era:1910s; brick construction",
      "id": "building_facade"
    },
    {
      "object": "sky",
      "grounding_phrase": "the sky above the bridge",
      "base_prior": "kb:sky",
      "modifiers": [
        {
          "family": "weather",
          "value": "overcast",
          "effect": "diffuse illumination flattens chroma, slight cool cast"
        },
        {
          "family": "era",
          "value": "1910s",
          "effect": "muted palette; sober dyes, and cars essentially all black"
        }
      ],
      "resolved_colour": {
        "space": "Lab",
        "L": 33.7,
        "a": 9.5,
        "b": 5.5
      },
      "tolerance_delta_e": 13.5,
      "confidence": 0.8,
      "rationale": "[era_1910s] KB prior 'sky' mode 'dusk'; modifiers: weather:overcast; not operative: era:1910s; warm low-sun sky",
      "id": "sky"
    },
    {
      "object": "asphalt",
      "grounding_phrase": "the road surface of the bridge",
      "base_prior": "kb:asphalt",
      "modifiers": [
        {
          "family": "weather",
          "value": "overcast",
          "effect": "diffuse illumination flattens chroma, slight cool cast"
        },
        {
          "family": "era",
          "value": "1910s",
          "effect": "muted palette; sober dyes, and cars essentially all black"
        }
      ],
      "resolved_colour": {
        "space": "Lab",
        "L": 33.7,
        "a": -1.0,
        "b": 0.2
      },
      "tolerance_delta_e": 6.0,
      "confidence": 0.8,
      "rationale": "[era_1910s] KB prior 'asphalt' mode 'worn'; modifiers: weather:overcast; not operative: era:1910s; neutral grey",
      "id": "asphalt"
    }
  ]
}