{
  "plan_version": "1.0",
  "image_id": "000000018770",
  "prompt": "a cheerful, upbeat scene",
  "regions": [
    {
      "object": "suit",
      "grounding_phrase": "the dark suit of the man",
      "base_prior": "kb:suit",
      "modifiers": [
        {
          "family": "mood",
          "value": "cheerful",
          "effect": "saturated, warm-leaning"
        }
      ],
      "resolved_colour": {
        "space": "Lab",
        "L": 5.5,
        "a": 2.0,
        "b": 4.0
      },
      "tolerance_delta_e": 6.0,
      "confidence": 0.8,
      "rationale": "[mood_cheerful] KB prior 'suit' mode 'charcoal'; modifiers: mood:cheerful; black/charcoal",
      "id": "suit"
    },
    {
      "object": "wall_interior",
      "grounding_phrase": "the dark wall behind the man",
      "base_prior": "kb:wall_interior",
      "modifiers": [
        {
          "family": "mood",
          "value": "cheerful",
          "effect": "saturated, warm-leaning"
        }
      ],
      "resolved_colour": {
        "space": "Lab",
        "L": 8.2,
        "a": 3.2,
        "b": 9.0
      },
      "tolerance_delta_e": 6.0,
      "confidence": 0.8,
      "rationale": "[mood_cheerful] KB prior 'wall_interior' mode 'white'; modifiers: mood:cheerful; off-white paint",
      "id": "wall_interior"
    }
  ]
}