{
  "plan_version": "1.0",
  "image_id": "000000026941",
  "prompt": "a photograph taken in the 1910s",
  "regions": [
    {
      "object": "suit",
      "grounding_phrase": "the suitcases on the cart",
      "base_prior": "kb:suit",
      "modifiers": [
        {
          "family": "weather",
          "value": "overcast",
          "effect": "diffuse illumination flattens chroma, slight cool cast"
        },
        {
          "family": "era",
          "value": "1910s",
          "effect": "muted palette; sober dyes, and cars essentially all black"
        }
      ],
      "resolved_colour": {
        "space": "Lab",
        "L": 53.7,
        "a": 0.0,
        "b": 0.0
      },
      "tolerance_delta_e": 6.0,
      "confidence": 0.8,
      "rationale": "[era_1910s] KB prior 'suit' mode 'charcoal'; modifiers: era:1910s; not operative: weather:overcast; black/charcoal",
      "id": "suit"
    },
    {
      "object": "building_facade",
      "grounding_phrase": "the wall behind the cart",
      "base_prior": "kb:building_facade",
      "modifiers": [
        {
          "family": "weather",
          "value": "overcast",
          "effect": "diffuse illumination flattens chroma, slight cool cast"
        },
        {
          "family": "era",
          "value": "1910s",
          "effect": "muted palette; sober dyes, and cars essentially all black"
        }
      ],
      "resolved_colour": {
        "space": "Lab",
        "L": 49.0,
        "a": 2.0,
        "b": 5.5
      },
      "tolerance_delta_e": 12.0,
      "confidence": 0.8,
      "rationale": "[era_1910s] KB prior 'building_facade' mode 'painted'; modifiers: weather:overcast; not operative: era:1910s; painted render",
      "id": "building_facade"
    }
  ]
}