{
  "plan_version": "1.0",
  "image_id": "000000017905",
  "prompt": "a photograph taken in the 1970s",
  "regions": [
    {
      "object": "foliage",
      "grounding_phrase": "the dense foliage behind the man",
      "base_prior": "kb:foliage",
      "modifiers": [
        {
          "family": "season",
          "value": "summer",
          "effect": "peak canopy green"
        },
        {
          "family": "weather",
          "value": "overcast",
          "effect": "diffuse illumination flattens chroma, slight cool cast"
        },
        {
          "family": "era",
          "value": "1970s",
          "effect": "avocado / harvest gold / burnt orange across decor, dress, and cars"
        }
      ],
      "resolved_colour": {
        "space": "Lab",
        "L": 82.0,
        "a": -22.0,
        "b": 23.5
      },
      "tolerance_delta_e": 12.0,
      "confidence": 0.8,
      "rationale": "[era_1970s] KB prior 'foliage' mode 'verdant'; modifiers: season:summer, weather:overcast; not operative: era:1970s; broadleaf summer canopy",
      "id": "foliage"
    },
    {
      "object": "building_facade",
      "grounding_phrase": "the building facade behind the man",
      "base_prior": "kb:building_facade",
      "modifiers": [
        {
          "family": "weather",
          "value": "overcast",
          "effect": "diffuse illumination flattens chroma, slight cool cast"
        },
        {
          "family": "era",
          "value": "1970s",
          "effect": "avocado / harvest gold / burnt orange across decor, dress, and cars"
        }
      ],
      "resolved_colour": {
        "space": "Lab",
        "L": 82.0,
        "a": 2.0,
        "b": 5.5
      },
      "tolerance_delta_e": 12.0,
      "confidence": 0.8,
      "rationale": "[era_1970s] KB prior 'building_facade' mode 'painted'; modifiers: weather:overcast; not operative: era:1970s; painted render",
      "id": "building_facade"
    },
    {
      "object": "asphalt",
      "grounding_phrase": "the gravel path beneath the man",
      "base_prior": "kb:asphalt",
      "modifiers": [
        {
          "family": "weather",
          "value": "overcast",
          "effect": "diffuse illumination flattens chroma, slight cool cast"
        },
        {
          "family": "era",
          "value": "1970s",
          "effect": "avocado / harvest gold / burnt orange across decor, dress, and cars"
        }
      ],
      "resolved_colour": {
        "space": "Lab",
        "L": 82.0,
        "a": -1.0,
        "b": 0.2
      },
      "tolerance_delta_e": 6.0,
      "confidence": 0.8,
      "rationale": "[era_1970s] KB prior 'asphalt' mode 'worn'; modifiers: weather:overcast; not operative: era:1970s; neutral grey",
      "id": "asphalt"
    }
  ]
}