{
  "plan_version": "1.0",
  "image_id": "000000017959",
  "prompt": "a melancholic, sombre scene",
  "regions": [
    {
      "object": "grass",
      "grounding_phrase": "the grassy field where the kites are flying",
      "base_prior": null,
      "modifiers": [
        {
          "family": "mood",
          "value": "melancholic",
          "effect": "desaturate + cool bias (the project's canonical mood)"
        }
      ],
      "resolved_colour": {
        "space": "Lab",
        "L": 26.7,
        "a": 6.1,
        "b": 12.2
      },
      "tolerance_delta_e": 10.5,
      "confidence": 0.6,
      "rationale": "[mood_melancholic] KB prior 'grass' mode 'verdant'; modifiers: mood:melancholic; healthy chlorophyll green | ABLATION: colour #5e4a3b chosen by model, KB bypassed",
      "id": "grass"
    },
    {
      "object": "foliage",
      "grounding_phrase": "the trees in the background",
      "base_prior": null,
      "modifiers": [
        {
          "family": "mood",
          "value": "melancholic",
          "effect": "desaturate + cool bias (the project's canonical mood)"
        }
      ],
      "resolved_colour": {
        "space": "Lab",
        "L": 40.8,
        "a": 3.6,
        "b": 12.2
      },
      "tolerance_delta_e": 12.0,
      "confidence": 0.6,
      "rationale": "[mood_melancholic] KB prior 'foliage' mode 'verdant'; modifiers: mood:melancholic; broadleaf summer canopy | ABLATION: colour #6c5c4b chosen by model, KB bypassed",
      "id": "foliage"
    },
    {
      "object": "building_facade",
      "grounding_phrase": "the large building in the distance",
      "base_prior": null,
      "modifiers": [
        {
          "family": "mood",
          "value": "melancholic",
          "effect": "desaturate + cool bias (the project's canonical mood)"
        }
      ],
      "resolved_colour": {
        "space": "Lab",
        "L": 39.6,
        "a": 3.3,
        "b": 10.5
      },
      "tolerance_delta_e": 10.5,
      "confidence": 0.6,
      "rationale": "[mood_melancholic] KB prior 'building_facade' mode 'brick_red'; modifiers: mood:melancholic; brick construction | ABLATION: colour #7d6e5f chosen by model, KB bypassed",
      "id": "building_facade"
    }
  ]
}