{
  "plan_version": "1.0",
  "image_id": "000000033707",
  "prompt": "a cheerful, upbeat scene",
  "regions": [
    {
      "object": "building_facade",
      "grounding_phrase": "the building behind the giraffes",
      "base_prior": null,
      "modifiers": [
        {
          "family": "weather",
          "value": "overcast",
          "effect": "diffuse illumination flattens chroma, slight cool cast"
        },
        {
          "family": "mood",
          "value": "cheerful",
          "effect": "saturated, warm-leaning"
        }
      ],
      "resolved_colour": {
        "space": "Lab",
        "L": 74.9,
        "a": -1.7,
        "b": 78.0
      },
      "tolerance_delta_e": 12.0,
      "confidence": 0.8,
      "rationale": "[mood_cheerful] KB prior 'building_facade' mode 'painted'; modifiers: weather:overcast, mood:cheerful; painted render | ABLATION: colour #FFD700 chosen by model, KB bypassed",
      "id": "building_facade"
    },
    {
      "object": "foliage",
      "grounding_phrase": "the trees in the background",
      "base_prior": null,
      "modifiers": [
        {
          "family": "weather",
          "value": "overcast",
          "effect": "diffuse illumination flattens chroma, slight cool cast"
        },
        {
          "family": "mood",
          "value": "cheerful",
          "effect": "saturated, warm-leaning"
        }
      ],
      "resolved_colour": {
        "space": "Lab",
        "L": 31.4,
        "a": 26.4,
        "b": 41.0
      },
      "tolerance_delta_e": 12.0,
      "confidence": 0.8,
      "rationale": "[mood_cheerful] KB prior 'foliage' mode 'verdant'; modifiers: weather:overcast, mood:cheerful; broadleaf summer canopy | ABLATION: colour #8B4513 chosen by model, KB bypassed",
      "id": "foliage"
    }
  ]
}