{
  "plan_version": "1.0",
  "image_id": "000000033854",
  "prompt": "a photograph taken in the 1970s",
  "regions": [
    {
      "object": "building_facade",
      "grounding_phrase": "the building with scaffolding on the right",
      "base_prior": null,
      "modifiers": [
        {
          "family": "weather",
          "value": "overcast",
          "effect": "diffuse illumination flattens chroma, slight cool cast"
        },
        {
          "family": "era",
          "value": "1970s",
          "effect": "avocado / harvest gold / burnt orange across decor, dress, and cars"
        }
      ],
      "resolved_colour": {
        "space": "Lab",
        "L": 28.6,
        "a": -0.0,
        "b": 0.0
      },
      "tolerance_delta_e": 10.5,
      "confidence": 0.8,
      "rationale": "[era_1970s] KB prior 'building_facade' mode 'brick_red'; modifiers: weather:overcast; not operative: era:1970s; brick construction | ABLATION: colour #808080 chosen by model, KB bypassed",
      "id": "building_facade"
    },
    {
      "object": "car",
      "grounding_phrase": "the group of motorcycles in the center",
      "base_prior": null,
      "modifiers": [
        {
          "family": "weather",
          "value": "overcast",
          "effect": "diffuse illumination flattens chroma, slight cool cast"
        },
        {
          "family": "era",
          "value": "1970s",
          "effect": "avocado / harvest gold / burnt orange across decor, dress, and cars"
        }
      ],
      "resolved_colour": {
        "space": "Lab",
        "L": 12.2,
        "a": -0.0,
        "b": 0.0
      },
      "tolerance_delta_e": 7.5,
      "confidence": 0.8,
      "rationale": "[era_1970s] KB prior 'car' mode 'achromatic'; modifiers: era:1970s; not operative: weather:overcast; white/silver/grey/black majority | ABLATION: colour #4a4a4a chosen by model, KB bypassed",
      "id": "car"
    },
    {
      "object": "car",
      "grounding_phrase": "the vintage car on the left",
      "base_prior": null,
      "modifiers": [
        {
          "family": "weather",
          "value": "overcast",
          "effect": "diffuse illumination flattens chroma, slight cool cast"
        },
        {
          "family": "era",
          "value": "1970s",
          "effect": "avocado / harvest gold / burnt orange across decor, dress, and cars"
        }
      ],
      "resolved_colour": {
        "space": "Lab",
        "L": 10.6,
        "a": -0.0,
        "b": 0.0
      },
      "tolerance_delta_e": 7.5,
      "confidence": 0.8,
      "rationale": "[era_1970s] KB prior 'car' mode 'achromatic'; modifiers: era:1970s; not operative: weather:overcast; white/silver/grey/black majority | ABLATION: colour #333333 chosen by model, KB bypassed",
      "id": "car_2"
    }
  ]
}