{
  "plan_version": "1.0",
  "image_id": "000000035963",
  "prompt": "a melancholic, sombre scene",
  "regions": [
    {
      "object": "grass",
      "grounding_phrase": "the patch of dirt surrounding the statue",
      "base_prior": "kb:grass",
      "modifiers": [
        {
          "family": "mood",
          "value": "melancholic",
          "effect": "desaturate + cool bias (the project's canonical mood)"
        }
      ],
      "resolved_colour": {
        "space": "Lab",
        "L": 65.1,
        "a": -23.0,
        "b": 20.2
      },
      "tolerance_delta_e": 10.5,
      "confidence": 0.6,
      "rationale": "[mood_melancholic] KB prior 'grass' mode 'verdant'; modifiers: mood:melancholic; healthy chlorophyll green",
      "id": "grass"
    },
    {
      "object": "building_facade",
      "grounding_phrase": "the building facade in the background",
      "base_prior": "kb:building_facade",
      "modifiers": [
        {
          "family": "mood",
          "value": "melancholic",
          "effect": "desaturate + cool bias (the project's canonical mood)"
        }
      ],
      "resolved_colour": {
        "space": "Lab",
        "L": 25.9,
        "a": 13.4,
        "b": 10.4
      },
      "tolerance_delta_e": 10.5,
      "confidence": 0.8,
      "rationale": "[mood_melancholic] KB prior 'building_facade' mode 'brick_red'; modifiers: mood:melancholic; brick construction",
      "id": "building_facade"
    },
    {
      "object": "foliage",
      "grounding_phrase": "the plants behind the statue",
      "base_prior": "kb:foliage",
      "modifiers": [
        {
          "family": "mood",
          "value": "melancholic",
          "effect": "desaturate + cool bias (the project's canonical mood)"
        }
      ],
      "resolved_colour": {
        "space": "Lab",
        "L": 65.1,
        "a": -21.6,
        "b": 18.8
      },
      "tolerance_delta_e": 12.0,
      "confidence": 0.8,
      "rationale": "[mood_melancholic] KB prior 'foliage' mode 'verdant'; modifiers: mood:melancholic; broadleaf summer canopy",
      "id": "foliage"
    }
  ]
}