{
  "plan_version": "1.0",
  "image_id": "000000028993",
  "prompt": "a melancholic, sombre scene",
  "regions": [
    {
      "object": "asphalt",
      "grounding_phrase": "the street in the middle of the image",
      "base_prior": null,
      "modifiers": [
        {
          "family": "weather",
          "value": "overcast",
          "effect": "diffuse illumination flattens chroma, slight cool cast"
        },
        {
          "family": "mood",
          "value": "melancholic",
          "effect": "desaturate + cool bias (the project's canonical mood)"
        }
      ],
      "resolved_colour": {
        "space": "Lab",
        "L": 85.9,
        "a": -0.0,
        "b": 0.0
      },
      "tolerance_delta_e": 6.0,
      "confidence": 0.8,
      "rationale": "[mood_melancholic] KB prior 'asphalt' mode 'worn'; modifiers: weather:overcast, mood:melancholic; neutral grey | ABLATION: colour #4a4a4a chosen by model, KB bypassed",
      "id": "asphalt"
    },
    {
      "object": "building_facade",
      "grounding_phrase": "the large building in the background",
      "base_prior": null,
      "modifiers": [
        {
          "family": "mood",
          "value": "melancholic",
          "effect": "desaturate + cool bias (the project's canonical mood)"
        }
      ],
      "resolved_colour": {
        "space": "Lab",
        "L": 23.1,
        "a": -0.0,
        "b": 0.0
      },
      "tolerance_delta_e": 12.0,
      "confidence": 0.8,
      "rationale": "[mood_melancholic] KB prior 'building_facade' mode 'painted'; modifiers: mood:melancholic; painted render | ABLATION: colour #333333 chosen by model, KB bypassed",
      "id": "building_facade"
    },
    {
      "object": "brick",
      "grounding_phrase": "the facade of the building in the background",
      "base_prior": null,
      "modifiers": [
        {
          "family": "mood",
          "value": "melancholic",
          "effect": "desaturate + cool bias (the project's canonical mood)"
        }
      ],
      "resolved_colour": {
        "space": "Lab",
        "L": 23.5,
        "a": -0.0,
        "b": 0.0
      },
      "tolerance_delta_e": 10.5,
      "confidence": 0.8,
      "rationale": "[mood_melancholic] KB prior 'brick' mode 'red'; modifiers: mood:melancholic; fired clay red | ABLATION: colour #333333 chosen by model, KB bypassed",
      "id": "brick"
    },
    {
      "object": "sky",
      "grounding_phrase": "the sky above the buildings",
      "base_prior": null,
      "modifiers": [
        {
          "family": "weather",
          "value": "overcast",
          "effect": "diffuse illumination flattens chroma, slight cool cast"
        },
        {
          "family": "mood",
          "value": "melancholic",
          "effect": "desaturate + cool bias (the project's canonical mood)"
        }
      ],
      "resolved_colour": {
        "space": "Lab",
        "L": 99.6,
        "a": -0.0,
        "b": 0.0
      },
      "tolerance_delta_e": 6.0,
      "confidence": 0.8,
      "rationale": "[mood_melancholic] KB prior 'sky' mode 'overcast'; modifiers: weather:overcast, mood:melancholic; grey overcast cover | ABLATION: colour #808080 chosen by model, KB bypassed",
      "id": "sky"
    }
  ]
}