{
  "plan_version": "1.0",
  "image_id": "000000001353",
  "prompt": "a photograph taken in the 1970s",
  "regions": [
    {
      "object": "building_facade",
      "grounding_phrase": "the large structure behind the children",
      "base_prior": "kb:building_facade",
      "modifiers": [
        {
          "family": "weather",
          "value": "overcast",
          "effect": "diffuse illumination flattens chroma, slight cool cast"
        },
        {
          "family": "mood",
          "value": "nostalgic",
          "effect": "warm fade, as in aged prints"
        },
        {
          "family": "era",
          "value": "1970s",
          "effect": "avocado / harvest gold / burnt orange across decor, dress, and cars"
        }
      ],
      "resolved_colour": {
        "space": "Lab",
        "L": 8.2,
        "a": 6.6,
        "b": 13.4
      },
      "tolerance_delta_e": 12.0,
      "confidence": 0.8,
      "rationale": "[era_1970s] KB prior 'building_facade' mode 'painted'; modifiers: weather:overcast, mood:nostalgic; not operative: era:1970s; painted render",
      "id": "building_facade"
    },
    {
      "object": "dress",
      "grounding_phrase": "the dark jumper of the child in the foreground",
      "base_prior": "kb:dress",
      "modifiers": [
        {
          "family": "mood",
          "value": "nostalgic",
          "effect": "warm fade, as in aged prints"
        },
        {
          "family": "era",
          "value": "1970s",
          "effect": "avocado / harvest gold / burnt orange across decor, dress, and cars"
        }
      ],
      "resolved_colour": {
        "space": "Lab",
        "L": 4.3,
        "a": 4.1,
        "b": 7.5
      },
      "tolerance_delta_e": 15.0,
      "confidence": 0.8,
      "rationale": "[era_1970s] KB prior 'dress' mode 'earth'; modifiers: mood:nostalgic, era:1970s; browns/olives",
      "id": "dress"
    },
    {
      "object": "rug",
      "grounding_phrase": "the patterned surface beneath the train",
      "base_prior": "kb:rug",
      "modifiers": [
        {
          "family": "mood",
          "value": "nostalgic",
          "effect": "warm fade, as in aged prints"
        },
        {
          "family": "era",
          "value": "1970s",
          "effect": "avocado / harvest gold / burnt orange across decor, dress, and cars"
        }
      ],
      "resolved_colour": {
        "space": "Lab",
        "L": 46.7,
        "a": 17.8,
        "b": 25.0
      },
      "tolerance_delta_e": 15.0,
      "confidence": 0.7,
      "rationale": "[era_1970s] KB prior 'rug' mode 'warm'; modifiers: mood:nostalgic, era:1970s; warm reds/browns common in rugs",
      "id": "rug"
    },
    {
      "object": "wall_interior",
      "grounding_phrase": "the wall to the right of the children",
      "base_prior": "kb:wall_interior",
      "modifiers": [
        {
          "family": "mood",
          "value": "nostalgic",
          "effect": "warm fade, as in aged prints"
        },
        {
          "family": "era",
          "value": "1970s",
          "effect": "avocado / harvest gold / burnt orange across decor, dress, and cars"
        }
      ],
      "resolved_colour": {
        "space": "Lab",
        "L": 12.9,
        "a": 5.8,
        "b": 12.2
      },
      "tolerance_delta_e": 6.0,
      "confidence": 0.8,
      "rationale": "[era_1970s] KB prior 'wall_interior' mode 'white'; modifiers: mood:nostalgic, era:1970s; off-white paint",
      "id": "wall_interior"
    }
  ]
}